[
  {
    "id": "O-IMD-RAINFALL-DEP-india-20260923",
    "metric_id": "rainfall_departure_pct",
    "series_id": "imd_2026_jun1_to_date_gif",
    "definition_version": "provider-displayed-2026-09-23",
    "geography_id": "india",
    "boundary_version": "imd-homogeneous-2026-no-geometry",
    "period": {
      "start": "2026-06-01T00:00:00+05:30",
      "end": "2026-09-23T00:00:00+05:30",
      "timezone": "Asia/Kolkata",
      "kind": "season_to_date",
      "cutoff_convention": "IMD graphic labels dates June 1 through September 23; clock hour is not specified. Times in this record encode calendar dates only."
    },
    "value": -14.9,
    "unit": "percent",
    "status": "observed",
    "missing_reason": null,
    "normal_value": null,
    "baseline_id": "imd-1971-2020",
    "cohort_id": null,
    "population_basis": null,
    "coverage_fraction": null,
    "evidence_ids": [
      "E-IMD-ALLINDIA-20260923"
    ],
    "quality_flags": [
      "provider_graphic_rounded",
      "date_precision_only"
    ],
    "synthetic": false,
    "public": true
  },
  {
    "id": "O-IMD-RAINFALL-DEP-imd-northwest-20260923",
    "metric_id": "rainfall_departure_pct",
    "series_id": "imd_2026_jun1_to_date_gif",
    "definition_version": "provider-displayed-2026-09-23",
    "geography_id": "imd:northwest",
    "boundary_version": "imd-homogeneous-2026-no-geometry",
    "period": {
      "start": "2026-06-01T00:00:00+05:30",
      "end": "2026-09-23T00:00:00+05:30",
      "timezone": "Asia/Kolkata",
      "kind": "season_to_date",
      "cutoff_convention": "IMD graphic labels dates June 1 through September 23; clock hour is not specified. Times in this record encode calendar dates only."
    },
    "value": -10.5,
    "unit": "percent",
    "status": "observed",
    "missing_reason": null,
    "normal_value": null,
    "baseline_id": null,
    "cohort_id": null,
    "population_basis": null,
    "coverage_fraction": null,
    "evidence_ids": [
      "E-IMD-HOMO-20260923"
    ],
    "quality_flags": [
      "provider_graphic_rounded",
      "date_precision_only",
      "cumulative_baseline_unconfirmed"
    ],
    "synthetic": false,
    "public": true
  },
  {
    "id": "O-IMD-RAINFALL-DEP-imd-east-northeast-20260923",
    "metric_id": "rainfall_departure_pct",
    "series_id": "imd_2026_jun1_to_date_gif",
    "definition_version": "provider-displayed-2026-09-23",
    "geography_id": "imd:east-northeast",
    "boundary_version": "imd-homogeneous-2026-no-geometry",
    "period": {
      "start": "2026-06-01T00:00:00+05:30",
      "end": "2026-09-23T00:00:00+05:30",
      "timezone": "Asia/Kolkata",
      "kind": "season_to_date",
      "cutoff_convention": "IMD graphic labels dates June 1 through September 23; clock hour is not specified. Times in this record encode calendar dates only."
    },
    "value": -26.5,
    "unit": "percent",
    "status": "observed",
    "missing_reason": null,
    "normal_value": null,
    "baseline_id": null,
    "cohort_id": null,
    "population_basis": null,
    "coverage_fraction": null,
    "evidence_ids": [
      "E-IMD-HOMO-20260923"
    ],
    "quality_flags": [
      "provider_graphic_rounded",
      "date_precision_only",
      "cumulative_baseline_unconfirmed"
    ],
    "synthetic": false,
    "public": true
  },
  {
    "id": "O-IMD-RAINFALL-DEP-imd-central-20260923",
    "metric_id": "rainfall_departure_pct",
    "series_id": "imd_2026_jun1_to_date_gif",
    "definition_version": "provider-displayed-2026-09-23",
    "geography_id": "imd:central",
    "boundary_version": "imd-homogeneous-2026-no-geometry",
    "period": {
      "start": "2026-06-01T00:00:00+05:30",
      "end": "2026-09-23T00:00:00+05:30",
      "timezone": "Asia/Kolkata",
      "kind": "season_to_date",
      "cutoff_convention": "IMD graphic labels dates June 1 through September 23; clock hour is not specified. Times in this record encode calendar dates only."
    },
    "value": -5.3,
    "unit": "percent",
    "status": "observed",
    "missing_reason": null,
    "normal_value": null,
    "baseline_id": null,
    "cohort_id": null,
    "population_basis": null,
    "coverage_fraction": null,
    "evidence_ids": [
      "E-IMD-HOMO-20260923"
    ],
    "quality_flags": [
      "provider_graphic_rounded",
      "date_precision_only",
      "cumulative_baseline_unconfirmed"
    ],
    "synthetic": false,
    "public": true
  },
  {
    "id": "O-IMD-RAINFALL-DEP-imd-south-peninsular-20260923",
    "metric_id": "rainfall_departure_pct",
    "series_id": "imd_2026_jun1_to_date_gif",
    "definition_version": "provider-displayed-2026-09-23",
    "geography_id": "imd:south-peninsular",
    "boundary_version": "imd-homogeneous-2026-no-geometry",
    "period": {
      "start": "2026-06-01T00:00:00+05:30",
      "end": "2026-09-23T00:00:00+05:30",
      "timezone": "Asia/Kolkata",
      "kind": "season_to_date",
      "cutoff_convention": "IMD graphic labels dates June 1 through September 23; clock hour is not specified. Times in this record encode calendar dates only."
    },
    "value": -25.7,
    "unit": "percent",
    "status": "observed",
    "missing_reason": null,
    "normal_value": null,
    "baseline_id": null,
    "cohort_id": null,
    "population_basis": null,
    "coverage_fraction": null,
    "evidence_ids": [
      "E-IMD-HOMO-20260923"
    ],
    "quality_flags": [
      "provider_graphic_rounded",
      "date_precision_only",
      "cumulative_baseline_unconfirmed"
    ],
    "synthetic": false,
    "public": true
  },
  {
    "id": "O-CWC-LIVE-STORAGE-india-178-20260910",
    "metric_id": "reservoir_live_storage_bcm",
    "series_id": "cwc_rsms_weekly_178_2026",
    "definition_version": "cwc-rsms-live-storage-2026-09-10",
    "geography_id": "cwc:india-178",
    "boundary_version": "cwc-rsms-178-reservoir-cohort-2026-09-10",
    "period": {
      "start": "2026-09-10T00:00:00+05:30",
      "end": "2026-09-10T00:00:00+05:30",
      "timezone": "Asia/Kolkata",
      "kind": "instant",
      "cutoff_convention": "Bulletin status date is 10 September 2026; 00:00 is a calendar-date placeholder, not a measurement hour."
    },
    "value": 130.554,
    "unit": "BCM",
    "status": "observed",
    "missing_reason": null,
    "normal_value": 140.271,
    "baseline_id": "cwc-corresponding-week-previous-ten-years",
    "cohort_id": "cwc-rsms-178-2026-09-10",
    "population_basis": null,
    "coverage_fraction": null,
    "evidence_ids": [
      "E-CWC-RSMS-20260910"
    ],
    "quality_flags": [
      "Monitored reservoirs only; not all national water storage.",
      "10 September status, not a 24 September reading."
    ],
    "synthetic": false,
    "public": true
  },
  {
    "id": "O-CWC-LIVE-STORAGE-south-50-20260910",
    "metric_id": "reservoir_live_storage_bcm",
    "series_id": "cwc_rsms_weekly_178_2026",
    "definition_version": "cwc-rsms-live-storage-2026-09-10",
    "geography_id": "cwc:south-50",
    "boundary_version": "cwc-rsms-178-reservoir-cohort-2026-09-10",
    "period": {
      "start": "2026-09-10T00:00:00+05:30",
      "end": "2026-09-10T00:00:00+05:30",
      "timezone": "Asia/Kolkata",
      "kind": "instant",
      "cutoff_convention": "Bulletin status date is 10 September 2026; 00:00 is a calendar-date placeholder, not a measurement hour."
    },
    "value": 30.467,
    "unit": "BCM",
    "status": "observed",
    "missing_reason": null,
    "normal_value": 40.827,
    "baseline_id": "cwc-corresponding-week-previous-ten-years",
    "cohort_id": "cwc-rsms-south-50-2026-09-10",
    "population_basis": null,
    "coverage_fraction": null,
    "evidence_ids": [
      "E-CWC-RSMS-20260910"
    ],
    "quality_flags": [
      "Monitored reservoirs only; not all national water storage.",
      "10 September status, not a 24 September reading."
    ],
    "synthetic": false,
    "public": true
  },
  {
    "id": "O-DCA-ONION-BLR-20250923",
    "metric_id": "retail_onion_price_inr_per_kg",
    "series_id": "dca_centrewise_onion_bengaluru",
    "definition_version": "dca-form-snapshot-2026-09-24",
    "geography_id": "dca:bengaluru-onion-centre",
    "boundary_version": "named-monitoring-centre-no-geometry",
    "period": {
      "start": "2025-09-23T00:00:00+05:30",
      "end": "2025-09-23T00:00:00+05:30",
      "timezone": "Asia/Kolkata",
      "kind": "day",
      "cutoff_convention": "DCA centrewise report selected calendar date; no market sample or clock hour is specified. Time encodes date only."
    },
    "value": 23,
    "unit": "INR/kg",
    "status": "observed",
    "missing_reason": null,
    "normal_value": null,
    "baseline_id": null,
    "cohort_id": "DCA-named-Bengaluru-centre",
    "population_basis": null,
    "coverage_fraction": null,
    "evidence_ids": [
      "E-DCA-ONION-BLR-20250923"
    ],
    "quality_flags": [
      "provider_reported",
      "centre_sample_unknown",
      "date_precision_only"
    ],
    "synthetic": false,
    "public": true
  },
  {
    "id": "O-DCA-ONION-BLR-20260923",
    "metric_id": "retail_onion_price_inr_per_kg",
    "series_id": "dca_centrewise_onion_bengaluru",
    "definition_version": "dca-form-snapshot-2026-09-24",
    "geography_id": "dca:bengaluru-onion-centre",
    "boundary_version": "named-monitoring-centre-no-geometry",
    "period": {
      "start": "2026-09-23T00:00:00+05:30",
      "end": "2026-09-23T00:00:00+05:30",
      "timezone": "Asia/Kolkata",
      "kind": "day",
      "cutoff_convention": "DCA centrewise report selected calendar date; no market sample or clock hour is specified. Time encodes date only."
    },
    "value": 57,
    "unit": "INR/kg",
    "status": "observed",
    "missing_reason": null,
    "normal_value": null,
    "baseline_id": null,
    "cohort_id": "DCA-named-Bengaluru-centre",
    "population_basis": null,
    "coverage_fraction": null,
    "evidence_ids": [
      "E-DCA-ONION-BLR-20260923"
    ],
    "quality_flags": [
      "provider_reported",
      "centre_sample_unknown",